Azure Data Engineer,The successful candidate will be an experienced data engineer with a background working in large organisations on enterprise platforms.,"We are looking for strong Front-End Developers with a good understanding of current web technologies such as Dojo, Node.js or Angular. Applicants should have a passion for learning new development tools and familiarity with GIS concepts. Extensive web application development experience, including UI design and construction, Working knowledge of current web technologies such as Dojo, Node.js or Angular, Strong Python and JavaScript skills.",3 years,Redcentric plc,Remote,3 weeks ago
Intern Project Analyst - Summer 2023,You will work closely with other members of business analyst and project manager teams as well as stakeholders to define project scope and objectives and will…,"Create pre-silicon verification test plans, Develop the architecture and design of the verification environment in OVM/UVM, Develop/run/debug tests and functional coverage in System Verilog·         Mentor other engineers in using the verification infrastructure and creating test benches, Experience with creation of plans, schedules and cost estimates for design verification efforts·         Experience with implementation of modern verification environments that include use of constrained-random stimulus and use of functional coverage, Proficiency in System Verilog, Experience with OVM/UVM, Proficiency in scripting languages and utilities including Make, Perl, Python, etc.· , Expert level knowledge of simulation tools such as VCS from Synopsys, Experience in network ASIC design verification is a plus, (ex:  Ethernet, PCI-Express, InfiniBand, SONET)",5+ Years,Computershare,Hybrid remote in Bristol,2 weeks ago
Data Analyst,"Experience of project delivery, planning of Workstream tasks/ system improvement projects.
Experience of leading on data administration and understanding of…","Take a leadership role by being self motivated and proactive in monitoring and analyzing existing databases, propose changes, and implementation of improvementsWork with software developers on providing SQL and store procedure analysisMake recommendations to developers on how to augment and/or modify application to better utilize data base interfaces to improve data base execution and performanceApply best practices and tools to analyze, debug, and resolve database performance issuesEvaluate current database schema design and work with software development to normalize and optimize data base layoutWork with operations on improving the monitoring of data base performance, capacity, and availabilityEvaluate content growth in data bases and make appropriate recommendations and adjustments to accommodate capacity proactivelyDrive back-up and replication strategy and implementation for production databases across all product lines to ensure recovery and/or failoverProvide a leadership role with defining and executing on disaster recovery / business continuance implementation and operationsEstablish and maintain security policy and procedures for data base servers and secure contentSignificant and demonstrated experience with Microsoft SQL Server database encryptionManage all housekeeping activities as they relate to data base managementRecommend and oversee the application of data base administration and management best practices to improve the overall operational efficiency of production data basesServe as a technical resource to internal employees and customers on recommending data base best practices and procedures to improve all aspects of data base operationExperience",3+ years,House of Commons,London,2 weeks ago
Project Manager,"Relevant project management qualification such as APM PMQ, or a ScrumMaster qualification, or equivalent experience.
Access to CPD days and training.",Must Have Skills (Top 3 technical skills only) * 1. Perl 2. Unix Desired years of experience*:Above 5 years Education/ Certifications (Required):BE,3-6 years,Software Solved Limited,Remote,1 month ago
Staff and Environment Data Analyst,"For an informal discussion, please contact Anne Mortimer, Research Evaluation Lead (anne.mortimer@admin.ox.ac.uk), on or before 4 April 2023.","Act as a lead in identification and troubleshooting processing issues impacting timely availability of data in the BigData or delivery of critical reporting within established SLAs. Provide mentoring to production support team. Identify and recommend technical improvements in production application solutions or operational processes in support of BigData platform and information delivery assets.  Focus on the overall stability and availability of the BigData platform and the associated interfaces and transport protocols.  Research, manage and coordinate resolution of complex issues through root cause analysis as appropriate  Establish and maintain productive relationships and effective communication with technical leads of key operational sources systems providing data to BigData platform, and infrastructure support groups.  Ensure adherence to established problem / incident management, change management and other internal IT processes  Responsible for communication related to day to day issues and problem resolutions. Ensure timely and accurate escalation of issues.  ",1-3 Years,University of Oxford,Hybrid remote in Oxford,1 month ago
Data Analyst,"Develop diagnostic reporting to highlight data quality issues in student record system.
Work with others in the team to support the development and…","Client anticipates utilizing a hybrid project management methodology incorporating both Waterfall and Agile/Scrum to organize cross-functional teams. Primary Responsibilities:  • Work closely and collaboratively with Program/Project Managers and Technical Leads to ensure mutual understanding of project goals and priorities• Facilitate discussions and decisions with business owners and technical team members to:o Conduct due diligence reviews and business analysis for complex decisions related to business processes, data cleansing, and data conversion effortso Clearly communicate complex technical design and solutions in business terms o Obtain consensus on solutionso Develop Use Cases that represent the scope of business needs• Document – and drive review and approval of – complex business processes• Assist in defining configuration specifications• Lead Quality Assurance effort, including developing testing methodology and test cases for the various stages of the data lake implementation• Constantly seek and communicate ways to improve monitoring, issue discovery, and delivering better value to the customer• Assist in managing activities of consultants/vendors associated with project efforts• Facilitate project logistics such as meeting planning (scheduling and agendas), conference rooms, conference calls, etc.• Document meeting discussions/decisions and action items; drive follow-up to ensure action item management and completion• Assist in creation and maintenance of project artifacts; such as project plans, project status reports, etc.",2 years,Birmingham City University,Hybrid remote in Birmingham,2 weeks ago
Project Manager,"You will have a proven track record in project risk management, importantly identifying potential risks and managing these throughout the duration of each…","Must have experience supporting Microsoft based server installations·       Must have experience working with Microsoft Release Management server product (formally InCycle)·       Strong experience writing and debugging Microsoft PowerShell and other scripting technologies·       Knowledge of analysis, design and configuration of complex multi-tiered server applications ·       Familiarity with SDLC, Quality Standards, and Best Practices ·       Effective organizational, problem solving and project management abilities Desirable Qualifications:·       Experience with Team Foundation Services Online (Visual Studio Online)·       Experience with build and deployment automation·       Experience with automated testing tools and testing procedures",5+ years,University of Wolverhampton,Wolverhampton,3 weeks ago
Service Desk Analyst,"LastPass or similar password management software.
Jamf Now (or similar remote device management software).
As well as managing our internal hardware, youll look…","Help identify coding patterns and anti-patterns and enforce implementation of the patterns through code reviews. * Builds a strong team using collaboration skills. * Communicates with different people in many situations. * Promotes improvements in version control, continuous integration, project build, and project automation. * Test-drives clean, quality code, working closely with other Agile team members. * Takes ownership of tasks when others do not. Helps drive the completion of all kinds of work tasks. * Helps break down, estimate, and provide just-in-time design for small increments of work. * Performs root cause analysis, technology evaluation, and design spikes. * Continuously learns, and is unafraid to learn new practices, processes, technologies, and languages. * Stays abreast of industry trends, technology trends, language trends, process trends. * Commits to completing well-defined work, and delivers on those commitments. * Participates in and may lead sprint review demonstrations. * Consistently follows software development methodology",2 years,Space 48 Ltd,Remote,1 week ago
Project & PMO Manager,"Tracking the progress of each project.
Degree educated or equivalent preferred.
Calculating the monetary risk for each project.
Who we’re looking for.","Strong capability to work across multiple teams to deliver value to our business partners.  The Senior Java Architect is responsible for but not limited to: • Act as technical lead for medium to large projects• Drive the design of solutions for the Extracare Loyalty program business that are scalable, maintainable, and reliable. Apply understanding of IT Standards and Design considerations for high volume online (OLTP) and batch transaction systems.• Proactively identify and evaluate emerging technologies and tools• Work with other senior Java software engineers to create the high-level J2EE software designs and technical specs• Evaluate package solutions and participate in selection of solutions to meet business needs and architecture standards• Participate in peer reviews on specifications, design and code• Work with development teams to resolve development and implementation issues• Work closely with the Extracare business team and Business Analysts to ensure that requirements are fully understood and documented in order to deliver quality design deliverables• Work closely with QA and Operations to ensure smooth QA and deployment of applications• Work with project teams to plan integration and implementation strategies",2 years,WHSmith,Greater London,6 days ago
Data Manager,"We are seeking to appoint a Data Manager to work closely with our team, to support the SLT and teaching staff with data management across the school.","The position will provide both in person and remote support on location at a leading technology company! Must have PC and Mac experience.  POSITION PROFILEThe Engineer provides advanced technical expertise in the Desktop Support area and is responsible for the daily site-specific network, workstation operating systems, workstation connectivity, workstation, peripheral hardware, and end-user applications. This position responds to Associate Technical Manager escalated support requests or management support requests and needs, with the primary focus being customer service and the ability to help, regardless of whether the problem is technical, user error, or training. The Engineer is responsible for following all Help Desk Standard Operating Procedures that pertain to the particular client site they are supporting.JOB DUTIES AND RESPONSIBILITIESThe Engineer is responsible for providing Tier 1-3 level IT Support. Assists in resolving user problems by providing support in-person, over the phone, or through email.Daily support of site-specific network and workstation operating systems, workstation connectivity, workstation and peripheral hardware, and end-user applications.Diagnoses complex system hardware, software and operator problems and recommends or performs any remedial actions necessary to correct problems based on knowledge of system operations.Participates in special projects as assigned by the supervisor.The Engineer should always Listen, Understand, Communicate, and then Deliver Support to the end user.Continuously informs the end user on the progress of the resolution.When instructed by IT or the Help Desk Manager, the Engineer keeps end users informed of any major problems or scheduled down times as he/she provides support.Test new or enhanced applications including systems enhancements and provides feedback to the Associate Technical Manager as well as the Client Site Manager of User Support.Provides end users with detailed remote access knowledge, and documents complete trouble shooting information.The Engineer is responsible for thoroughly documenting all relevant information to the support request ticket in the Help Desk Database upon closure of the ticket, or upon escalation of the support request to a Senior Engineer (Level 4)QUALIFICATIONS (Education, Experience, and Certifications)Typically Required:High School DiplomaSecondary School Degree PreferredTechnical Training & Certifications a plus (i.e.: ACSP, MCSE, MCSA, A+, NETWORK +, MCP)Three years of Desktop or Help Desk support experience required (application & hardware support)Windows and Apple support experience Demonstrate professional verbal and written communication across all levels of businessExceptional Customer Service skills required",2 years,The Beaulieu Park School,Chelmsford CM1,1 week ago
Developments and Costing Data Analyst,"They will ensure that the required data and information flows, continue to remain robust and fit for purpose.
This is an exciting opportunity for a Costing Data…","In this dynamic role, you will be responsible for two specific functions.  Salary for this role is in the dependent on experience. One function is the design, development, and maintenance of all new and existing EDI maps.  The second function is the configuration and maintenance of all new and existing eStores.EDI Responsibilities:Review requests from potential EDI Customers & Vendors. Send a Questionnaire to determine if they are EDI capable. Create Trading Partners, Map Requirements and other Controls within our legacy EDI Software. Work closely with our VAN to establish interconnects between our client and EDI Trading Partners. Test all new EDI Trading Partner Relationships & Transactions in a timely manner. Provide support to all EDI production processes and maintain all EDI Data Maps. Monitor and troubleshoot daily and weekly, Inbound & Outbound EDI Files and Transmissions. ",2 years,Guy's and St Thomas' NHS Foundation Trust,Hybrid remote in London SE1,3 weeks ago
Analyst,"You would be joining their expert team of consultants and analysts who support organisations with the collection, analysis, modelling, and interpretation of…","System Engineer with VMWare and EMC Market leading consultancy partner requires 2 x Systems Engineers with VMWare and EMC expertise for long term contract engagement in Cambridge, MA. To be considered you will have at least 5 years’ experience with VMWare virtualization, excellent VMWare and vSphere design, integration and deployment expertise and previous knowledge of leading system integration projects. You will be familiar with the following technologies;VMWare ESXI VDI Cluster, V6.0EMC VNX2 5400, EMC ISILON x400/410 s200/s210 and NL410 nodesWSUS/SCCMActive Directory Office 365 user security group distribution group creationEMC ISilion, SAN or NetApp storage administration and operation experience.CommVault, VEEAM integration and administration experience.Windows and Linux server administrationThe role will see you involved in the day to day operations with a particular focus on VMWare, EMC and Windows expertise.",2 years,Datasource,Remote,4 weeks ago
Project Manager,"Responsible for the financial implications of projects and programs.
Leading and managing the end-to-end process of a project/program.","Provide technical, test and project leadership and mentoring to a team of onshore and offshore software test engineers and test automation engineers. * Responsible for leading the end to end QA effort for large software platforms, services and products to ensure appropriate test coverage. * Will maintain, create and implement quality assurance processes, metrics and tools. * Will provide leadership with planning, estimating, scheduling, resources, deploying, and managing the testing effort for any given engagement/release. * Will work with cross-functional teams (product management, engineering, business analysts) to define, refine and execute software testing to ensure delivery of high quality product components. * Ensure effective collaboration between QA and other teams on the project * Work closely with the teams and QA personal to create effective Test Cases * Ensure that all areas of testing (e.g., system, functional, scalability, performance, reliability and regression) are successfully completed and documented and all problems are resolved.",2 years,On Track Recruitment,Remote in Alton,3 weeks ago
entry level/junior project manager to join our team,"As part of the project management team, you will deliver strategy, design, digital and interactive projects on time and on budget whilst exceeding our customers…","Knowledge of Selenium, Agile and Java ShopConsulting Experience- Analyze and provide feedbackKnowledge of software QA processes, methodologies, and statistical analysis are a must.Ability to read and analyze functional specifications is a must.In depth knowledge of some, but not all performance tools; Mercury Quick Test Pro, Mercury Winrunner, and Mercury LoadRunner, JMeter, SoapUI.In depth knowledge of IE Dev Tools, SQL Server Mgmt, SQL Developer, Eclipse, vSphere client server application.Working knowledge of some, but not all languages; VB, SQL, Python, Groovy, Java, JavaScript, HTML, etc.Working knowledge of Agile application, Confluence, Jira.Strong written and communication skills in an Agile environment.Strong problem solving skills, and the ability to effectively communicate internally and externally.Ability to perform tests against Web applications, front-end UI as well as back-end Databases, Application Servers, and Services.Understanding of most concepts, practices, and procedures within a Banking environment.Working knowledge of multiple operating systems (Unix and/or Windows based).Ability to write SQL queries and analyze databases (Oracle, MSSQL)",1 year,Spinning Clock,Nottingham,1 week ago
Data Manager,"Whether city life or rural living, Cardiff and the Vale offers the best of both worlds.
The SWBMT Programme Director is assisted by directors of the clinical,…","Codes, tests, debugs, implements, and documents moderately complex programs. Creates appropriate documentation in work assignments such as program code, and technical documentation. Designs systems and programs to meet complex business needs. Prepares detailed specifications from which programs are developed and coded. Ensures programs meet standards and technical specifications; performs technical analysis and component delivery. Gathers information from existing systems, analyzes program and time requirements. Assists project manager in preparing time estimates and justification for assigned tasks. Designs programs for projects or enhancements to existing programs. Writes specifications for programs of low to moderate complexity. Assists support and/or project personnel in resolving moderately complex program problems. Works with client and management to resolve issues and validate programming requirements within their areas of responsibility. Provides technical advice on complex programming. Develops test plans to verify logic of new or modified programs. Conducts quality assurance activities such as peer reviews. Creates appropriate documentation in work assignments such as program code, and technical documentation. Remains abreast of industry technical trends and new development to maintain current skills and remain current with industry standards.",2 years,Cardiff and Vale University Health Board,Cardiff CF14,2 weeks ago
Data Analyst (High Needs Block),"You will have HNC or NVQ Level 4 qualifications in statistical analysis or information management, or relevant experience.
Temporary/fixed term - 2 years.","Our client is seeking a Sr Project Manager for a PERM role. ***U.S. Citizens and those authorized to work in the U.S. are encouraged to apply. We are unable to sponsor at this time.*** Required Skills:Manages several projects of moderate to large scope and complexity, potentially a very large project, or multiple smaller projects simultaneously.Establishes, tracks and controls project scope, schedule, cost, and risk to deliver assigned projects within the approved targets.Plans, schedules and executes all phases of assigned projects in accordance with project management processes, policies, guidelines and corporate governance.Develops detailed project plans in accordance with project objectives and ensures project scope, team responsibilities, milestone dates and the procurement strategy are clearly stated for all assigned projects.Provides project progress reports to management and other stakeholders (including interdepartmental communication) in accordance with an approved communication plan.Provides accurate project forecasts for schedule and cost over the life of the project.Negotiates with vendors and contractors regarding work scope changes to ensure that all contract commitments are completed on time per the scope of work and technical specifications.Communicates with appropriate management levels - including senior management - to gain necessary approvals and manage risk in accordance with corporate governance.Provides performance feedback to administrative managers of project team members in support of the performance management lifecycle.Must Have: 7+ years of experience as a Project Manager including proven leadership capabilities combined with technical proficiency in one or more IT disciplines or relevant business experience combined with a strong technical acumen.Bachelor’s degree preferred or equivalent work experience.Experience with MS Project and Microsoft Office.Demonstrates effective leadership skills and continually leads by example.Excellent communication, interpersonal and influencing skills are essential.Actively supports and incorporates company mission and core values. Please e-mail your resume to mail@grgc.com",3 years,Wiltshire Council,Trowbridge,2 weeks ago
Band 8b Sub National Secure Data Environment Programme Manager,"Educated to Masters level or equivalent.
The post holder will have previous line management experience and a track record of successfully managing and…","Responsible for supporting all data and voice communications systems for our client.  The Network Administrator is also responsible for managing and monitoring network security.   In support of enterprise’s mission, the Network Administrator strives to provide all approved users of the enterprise with uninterrupted access to network resources in all office locations, wireless, Internet and remote connectivity to the enterprise’s network.  The Network Administrator will be responsible for educating approved enterprise users and professional IT staff on the proper use of the company’s wired and wireless infrastructure.Problems and ChallengesThe Network Administrator will be responsible for a complex, state-of-the-art communication network that will be rapidly changing to support the enterprise’s growth and development of new business opportunities.  The administrator is challenged with providing a secure voice, data and network environment that is reliable, flexible, and cost effective.Essential Position FunctionsPrincipal AccountabilitiesManage/configures routers, switches and all related WAN equipment.Monitors WAN for outages and works with vendors to resolve all issues.Manages and configures hardware associated with wireless and wired LANs.",3 years,University Hospitals Birmingham,Birmingham B15,2 weeks ago
