Graduate Financial Analyst,"Learning how to use SQL, the language we use to access our database, to analyst financial results and find new ways of making the finance team more efficient.","Learning how to use SQL, the language we use to access our database, to analyst financial results and find new ways of making the finance team more efficient.",5 years,SportPursuit,Manchester M2,2 weeks ago
HS2 Project Manager,"Are currently in care, or have previously been in care.
If you consider yourself to be disabled or if you have a long-term health condition.","Are currently in care, or have previously been in care.
If you consider yourself to be disabled or if you have a long-term health condition.",6 years,Manchester City Council,Hybrid remote in London E14,2 hours ago
Business Analyst Data Business Partner,"Defining data models based on metadata requirements, ensuring that data change is strategic, efficient and maintains integrity.","Defining data models based on metadata requirements, ensuring that data change is strategic, efficient and maintains integrity.",7 years,Barclays,Sandwich,3 days ago
Senior Data Manager,"Proficient experience using commercial clinical data management systems and/or EDC products.
Set-up and test data review listings to verify the quality and…","Proficient experience using commercial clinical data management systems and/or EDC products.
Set-up and test data review listings to verify the quality and…",8 years,Pfizer,London,2 weeks ago
Data Cabling Engineer,"We are looking for a number of experienced data cabling engineers who have a good knowledge and experience of data network cabling Cat 5e/6/6a, CW1308 along…","We are looking for a number of experienced data cabling engineers who have a good knowledge and experience of data network cabling Cat 5e/6/6a, CW1308 along…",9 years,Sudlows,London NW1,7 days ago
Property Project Manager,"Preparation of the project schedule.
Minimum 3yrs experience within project management.
Preparation and management of the project budget.","Preparation of the project schedule.
Minimum 3yrs experience within project management.
Preparation and management of the project budget.",5+ years,L'OCCITANE,Beckton,3 hours ago
Project Manager,Be educated to Higher National Certificate /degree level with a background in a relevant operational or project management capacity.,Be educated to Higher National Certificate /degree level with a background in a relevant operational or project management capacity.,3 years,Thames Water Utilites,Manchester,2 days ago
Assistant Project Manager (Consultancy),"Assigning and following-up project actions e.g. reporting project progress, monitoring costs and progress, acceptance of project specific procedures.","Assigning and following-up project actions e.g. reporting project progress, monitoring costs and progress, acceptance of project specific procedures.",1 year,Mace,Belfast,1 day ago
PCC Project Manager for Inquiries bAND 6,"Salary: Band 6 (£33k - £41k).
Tue, 11 April 2023 @ 6:00 PM.
Successful applicants have the opportunity to request Flexible Working from the 1st day of their…","Salary: Band 6 (£33k - £41k).
Tue, 11 April 2023 @ 6:00 PM.
Successful applicants have the opportunity to request Flexible Working from the 1st day of their…",5+ years,Health and Social Care Trust,Hybrid remote in Southwark SE1,2 weeks ago
Transformation Project Manger,"Proactively manage project budgets, providing accurate forecasting for project costs to ensure project is delivered to budget.","Proactively manage project budgets, providing accurate forecasting for project costs to ensure project is delivered to budget.",3+ years,Synnovis,Remote in London,3 days ago
Test Engineer Full Time Permanent,"Designing, writing and executing test cases to help maintain software quality.
Reviewing requirements to ensure that the software being developed meets the…","Designing, writing and executing test cases to help maintain software quality.
Reviewing requirements to ensure that the software being developed meets the…",5+ years,Pearson Carter,Uxbridge,2 weeks ago
Pricing Specialist & Data Analyst,"Strong data analysis skills, including data manipulation & modelling.
Experience of working with Oracle BI or other data tools (preferred).","Strong data analysis skills, including data manipulation & modelling.
Experience of working with Oracle BI or other data tools (preferred).",3 years,Canon,Slough SL1,2 days ago
BDS Master Data Senior Analyst,"3-5 years of application support, development, or project experience in various SAP functional areas.
Perform Quality & Assurance analysis for productionizing…","3-5 years of application support, development, or project experience in various SAP functional areas.
Perform Quality & Assurance analysis for productionizing…",5+ years,Mars,Hybrid remote in Glasgow,1 week ago
SPR Principal Project Manager - Offshore HVDC Converter Station,We will look for you to have experience in offshore projects or major electrical transmission project delivery including AC or DC Overhead Lines and Cable…,We will look for you to have experience in offshore projects or major electrical transmission project delivery including AC or DC Overhead Lines and Cable…,3 years,"SPW Renewable UK, Ltd",Remote in Cheltenham,7 days ago
Technical Project Manager (m/f/d),"You support your colleagues in technical workshops at the customer's location or remotely.
You have completed an apprenticeship as an IT system clerk or a…","You support your colleagues in technical workshops at the customer's location or remotely.
You have completed an apprenticeship as an IT system clerk or a…",1 year,Zalando,Hybrid remote in Stoke-on-Trent,2 days ago
Junior Information Security Analyst,"Degree in a related subject or experience in a technical support or operations environment is desirable.
Ability to examine data packets using Wireshark and…","Degree in a related subject or experience in a technical support or operations environment is desirable.
Ability to examine data packets using Wireshark and…",5+ years,bet365,Milton Keynes,2 weeks ago
Data Cabling Engineer,"An excellent understanding of health and safety practice preferably with either CSCS or ECS.
Vacation: 22 days in addition to Public Holidays.","An excellent understanding of health and safety practice preferably with either CSCS or ECS.
Vacation: 22 days in addition to Public Holidays.",3+ years,Puffin Solutions,Bridgend,2 weeks ago
Graduate Trainee Project Manager,Incredible career opportunity that would be perfect for graduates or trainees that have graduated with a project management qualification or similar related…,Incredible career opportunity that would be perfect for graduates or trainees that have graduated with a project management qualification or similar related…,5+ years,Carbon60 Global,Bournemouth,1 week ago
Ready to Launch/Change Readiness - Project Manager - VP,"Strong project management and organizational skills with the ability to manage multiple projects and prioritize high volume, high priority initiatives.","Strong project management and organizational skills with the ability to manage multiple projects and prioritize high volume, high priority initiatives.",3 years,"JPMorgan Chase Bank, N.A.",Remote,2 weeks ago
Project Manager,"Taking direction from colleagues to ensure the project is aligned with broader account strategies, however, for new customers the project manager may be the…","Taking direction from colleagues to ensure the project is aligned with broader account strategies, however, for new customers the project manager may be the…",5+ years,Redcentric plc,Hybrid remote in Bedford,2 weeks ago
Assistant Project Manager,"Plan and define project steps or schedules, consistent with defined review milestones and priorities, to contribute to the design of the overall project plan.","Plan and define project steps or schedules, consistent with defined review milestones and priorities, to contribute to the design of the overall project plan.",3 years,Highways England,South West,2 days ago
Project Manager,"We welcome qualified and experienced project managers from a range of management backgrounds, both within and beyond the environmental field.","We welcome qualified and experienced project managers from a range of management backgrounds, both within and beyond the environmental field.",1 year,Natural England,Woodchester,2 weeks ago
Project Engineer,"Analysis of process performance data to justify improvement actions.
Specific activities will vary dependant on the type of project:","Analysis of process performance data to justify improvement actions.
Specific activities will vary dependant on the type of project:",5+ years,RENISHAW PLC,Aberdeen,3 days ago
Project Engineer,The Project Engineer will be part of a team tasked with the delivery of Opex and Capex project scopes through all project stages (Appraisal to Execution) within…,The Project Engineer will be part of a team tasked with the delivery of Opex and Capex project scopes through all project stages (Appraisal to Execution) within…,3+ years,Orion,Warton,1 week ago
Project Manager,"Qualified Project Management practitioner or equivalent experience.
Developing own project and priorities to achieve goals.
What you’ll be doing:","Qualified Project Management practitioner or equivalent experience.
Developing own project and priorities to achieve goals.
What you’ll be doing:",5+ years,BAE Systems,Hammersmith,2 days ago
IT Project Manager,This will not only involve the production of detailed plans and project documentation but also continual leadership of the project team through the provision of…,This will not only involve the production of detailed plans and project documentation but also continual leadership of the project team through the provision of…,3 years,Harrods,London SE1,3 days ago
Senior Project Manager - Perioperative,"Manage project team to develop, refine and implement project data collection systems that will provide accurate and timely data, including quantitative and…","Manage project team to develop, refine and implement project data collection systems that will provide accurate and timely data, including quantitative and…",1 year,Guy's and St Thomas' NHS Foundation Trust,London,3 hours ago
GIS Data Analyst,"The role will be a Subject Matter Expert (SME) on GIS data management such as data production, content publishing, and compliance of data quality & assurance…","The role will be a Subject Matter Expert (SME) on GIS data management such as data production, content publishing, and compliance of data quality & assurance…",5+ years,High Speed Two (HS2),Hybrid remote in Basingstoke,6 days ago
Service Delivery Manager - Data,"Strong experience within Service Delivery across IT and Data specifically supporting in delivering and supporting data warehouse, data lake, reporting and data…","Strong experience within Service Delivery across IT and Data specifically supporting in delivering and supporting data warehouse, data lake, reporting and data…",3+ years,The AA,Remote in Basingstoke,2 weeks ago
Project Manager,Evaluating the success of the project against its benchmarking and sharing lessons or best practice with other organisations or project managers.,Evaluating the success of the project against its benchmarking and sharing lessons or best practice with other organisations or project managers.,5+ years,Zebra Technologies,Manchester,3 days ago
Project Manager - Healthcare projects,"As the project manager, you will work on multiple projects, running complex projects or programmes.
With new projects secured and a strong pipeline of…","As the project manager, you will work on multiple projects, running complex projects or programmes.
With new projects secured and a strong pipeline of…",3 years,Mace,West Yorkshire,1 week ago
Data Engineer,"For more information, please call Drew on 07795 574 922 or email Drew@coregroup.org.uk.
Core Group are looking for Data Engineers in the Leeds area to start…","For more information, please call Drew on 07795 574 922 or email Drew@coregroup.org.uk.
Core Group are looking for Data Engineers in the Leeds area to start…",1 year,Core Group,Doncaster,2 days ago
Transformation Project Manager (SEND),"For further details or an informal chat please contact: martyn.owen@doncaster.gov.uk.
Based at: Civic Office , Doncaster.
Closing date: 2nd April 2023.","For further details or an informal chat please contact: martyn.owen@doncaster.gov.uk.
Based at: Civic Office , Doncaster.
Closing date: 2nd April 2023.",5+ years,Doncaster City Council,Exeter,1 week ago
JockeyCam Data Analyst (KTP Associate) P87142,"An upper second or first class degree and/or Masters (or PhD at Grade F) in computer science, mechanical or electrical engineering, data science, biomechanics,…","An upper second or first class degree and/or Masters (or PhD at Grade F) in computer science, mechanical or electrical engineering, data science, biomechanics,…",3+ years,University of Exeter,Reading RG31,2 days ago
Junior Data Analyst,"Investigate data requirements, identify data gaps, research sources and provide recommendations/solutions to support the needs of the team or department.","Investigate data requirements, identify data gaps, research sources and provide recommendations/solutions to support the needs of the team or department.",5+ years,RAC,Stockport,1 day ago
Project Engineer (ISV),"A proven track record of contributing to major project work.
Qualification in an engineering discipline or clear demonstration of relevant experience.","A proven track record of contributing to major project work.
Qualification in an engineering discipline or clear demonstration of relevant experience.",3 years,Emerson,London,1 week ago
Data & AI Value Strategy Senior Manager,"Act as subject matter expert for Responsible AI within a data science / data transformation team.
Interaction is with senior management levels at a client and…","Act as subject matter expert for Responsible AI within a data science / data transformation team.
Interaction is with senior management levels at a client and…",2-5 years,Accenture,York,3 hours ago
Export Operational Project Manager,"Experience in leading and managing cross functional projects.
Singles point of Contact for all Export enquiries and resolution of Export escalations from or…","Experience in leading and managing cross functional projects.
Singles point of Contact for all Export enquiries and resolution of Export escalations from or…",0 year,Nestle,London,1 week ago
Data Engineer,"Computer science background or similar, and a good understanding of data engineering.
In both cases, please apply for our general software engineer vacancy …","Computer science background or similar, and a good understanding of data engineering.
In both cases, please apply for our general software engineer vacancy …",2-4+ years,Samotics B.V.,Thuiswerken,2 days ago
Junior Big Data Engineer,"Support the build data pipelines to collect data from different sources using real time or batch technologies;
Experience of 1+ years in this area;","Support the build data pipelines to collect data from different sources using real time or batch technologies;
Experience of 1+ years in this area;",1 year,CodeImpact,London,2 days ago
Graduate Quant Analyst - Start September 2023,"You have a Master’s degree or PhD in Physics, Mathematics, Statistics Quantitative Finance, or equivalent.
The types of projects you will be working on range…","You have a Master’s degree or PhD in Physics, Mathematics, Statistics Quantitative Finance, or equivalent.
The types of projects you will be working on range…",1 year,Mathrix,Amsterdam,1 week ago
Junior Big Data Engineer,"Als gemotiveerde Junior Big Data Engineer draag jij bij door data te prepareren, waardoor de klant beter gebruik kan maken van zijn data.","Als gemotiveerde Junior Big Data Engineer draag jij bij door data te prepareren, waardoor de klant beter gebruik kan maken van zijn data.",3+ years,Capgemini,Utrecht,2 weeks ago
Data Engineer,"Share knowledge in our data engineering community, pair program and collaborate on code together with other data engineers within NN.
At NN we work hybrid.","Share knowledge in our data engineering community, pair program and collaborate on code together with other data engineers within NN.
At NN we work hybrid.",5+ years,NN Group,Thuiswerken in 2595 Den Haag,2 weeks ago
Azure Data Engineer,"Should have following data engineering skills:
Strong IT experience with 5+ years of data engineering the cloud.
Good exposure to Azure platform.","Should have following data engineering skills:
Strong IT experience with 5+ years of data engineering the cloud.
Good exposure to Azure platform.",7 years,Gazelle Global Consulting,London,3 hours ago
Graduate Engineer - Netherlands - 2023,Abbreviated references describing global or regional operational organizations and global or regional business lines are also sometimes used for convenience and…,Abbreviated references describing global or regional operational organizations and global or regional business lines are also sometimes used for convenience and…,1 year,ExxonMobil,Botlek,7 days ago
Data entry medewerker,"Draagt er zorg voor dat al onze data van het ene Excel document naar het andere Excel document wordt overgezet.
Een reiskostenvergoeding conform onze CAO-VVT.","Draagt er zorg voor dat al onze data van het ene Excel document naar het andere Excel document wordt overgezet.
Een reiskostenvergoeding conform onze CAO-VVT.",2 year,Korian Nederland,Nederland,2 days ago
Graduate Research Analyst,"As a graduate research analyst at IMC, you will.
Academic background in a relevant field (e.g. Economics/Econometrics, Finance or STEM).
WHAT DO WE LOOK FOR?","As a graduate research analyst at IMC, you will.
Academic background in a relevant field (e.g. Economics/Econometrics, Finance or STEM).
WHAT DO WE LOOK FOR?",1 year,IMC Financial Markets,Amsterdam,1 week ago
Technical Pathfinder Data,"Providing expertise on data modeling, data structures, and data warehousing.
Expert-level knowledge of data modeling, structures, and warehousing.","Providing expertise on data modeling, data structures, and data warehousing.
Expert-level knowledge of data modeling, structures, and warehousing.",5+ years,Jumbo Supermarkten,Thuiswerken in 5462 Veghel,3 weeks ago
Online Dutch language teacher,"Class type: Online - via Zoom or Teams.
Native or near-native written and spoken proficiency in the target language.
This is a remote position.","Class type: Online - via Zoom or Teams.
Native or near-native written and spoken proficiency in the target language.
This is a remote position.",3+ years,Global LT,London,2 weeks ago
Job opportunities with the ICRC,"They also offer paid traineeships in headquarters in Switzerland to help young graduates obtain a first work experience.
Job opportunities with the ICRC.","They also offer paid traineeships in headquarters in Switzerland to help young graduates obtain a first work experience.
Job opportunities with the ICRC.",5+ years,Rode Kruis,Nederland,6 days ago
Full-time Customer Service Associate (work from home) - Seasonal Contract,"We won’t ask you to read from a script or learn dialogue by heart.
Protecting your privacy and the security of your data is a longstanding top priority for…","We won’t ask you to read from a script or learn dialogue by heart.
Protecting your privacy and the security of your data is a longstanding top priority for…",3 years,Amazon.com,Thuiswerken in Nederland,1 week ago
Tech Artist,"Development and improvement of technologies to optimize artists’ work.
Understanding the technical limitations when creating content for game engines.","Development and improvement of technologies to optimize artists’ work.
Understanding the technical limitations when creating content for game engines.",5-8 years,MY.GAMES,London,2 days ago
Data Engineer,"Experience processing large amounts of data in realtime or near realtime.
Experience with Scala or Java.
Ability to optimize data processing and loading.","Experience processing large amounts of data in realtime or near realtime.
Experience with Scala or Java.
Ability to optimize data processing and loading.",1 year,MY.GAMES,Thuiswerken,2 days ago
Banking Analyst - Expert Graduate Programme - 2023,"Be motivated with a strong degree or expected degree – in any area.
After several weeks of intensive training to start, you’ll join one of our industry, product…","Be motivated with a strong degree or expected degree – in any area.
After several weeks of intensive training to start, you’ll join one of our industry, product…",1-2/2-3 years,Barclays,Amsterdam,1 week ago
Search Operations Quality Assurance - Turkish,"Bachelor’s degree or above.
Quality inspection of labeled data on time and ensure the quality;
It is possible that this role will be exposed to harmful content…","Bachelor’s degree or above.
Quality inspection of labeled data on time and ensure the quality;
It is possible that this role will be exposed to harmful content…",1 year,TikTok,Amsterdam,1 week ago
Data analyst customer insights,"As an all-round data analyst, you are in charge of your tasks on the Kanban board.
From home or our headquarters in Zwaagdijk, you can help improve the customer…","As an all-round data analyst, you are in charge of your tasks on the Kanban board.
From home or our headquarters in Zwaagdijk, you can help improve the customer…",6-8 years,Action,Thuiswerken in Zwaagdijk-Oost,4 weeks ago
Graduate Equity Analyst Programme - September 2023 Start,"Minimum of Bachelor's – preferably in a STEM, economics or business related subject from a top-tier university.
Attend regular corporate access meetings.","Minimum of Bachelor's – preferably in a STEM, economics or business related subject from a top-tier university.
Attend regular corporate access meetings.",2 years,Optiver,Amsterdam,3 weeks ago
Data Analyst (PowerBI),"Develop data structures as basis for dashboards in close collaboration with data engineers.
As a data analyst your job is to work with BI tools to create…","Develop data structures as basis for dashboards in close collaboration with data engineers.
As a data analyst your job is to work with BI tools to create…",3 years,Apollo IT,Thuiswerken,1 week ago
European Graduate Program,"Entry level work experience (up to 2 years) and/or an internship in relevant areas.
We aim to develop top diverse talent towards future expert and managerial…","Entry level work experience (up to 2 years) and/or an internship in relevant areas.
We aim to develop top diverse talent towards future expert and managerial…",1 year,Cargill,Schiphol,2 days ago
Junior Trading Analyst,"Has deep data analysis skill.
Running data models (yield, demand), collecting statistics and data from agencies and other reports, support Supply & Demand…","Has deep data analysis skill.
Running data models (yield, demand), collecting statistics and data from agencies and other reports, support Supply & Demand…",3 years,Shell,Rotterdam,1 week ago
Data Engineer,"Commercial experience in the area of data engineering or machine learning.
Exposure to real time data ingestion / streaming data sources.","Commercial experience in the area of data engineering or machine learning.
Exposure to real time data ingestion / streaming data sources.",5+ Years,Cloud Technology Solutions,Newport,6 days ago
Graduate Trader,"Strong interest in trading (Experience in real or simulated trading is a plus).
Technical background (Maths, Physics, Engineering, Econometrics, Quant Finance…","Strong interest in trading (Experience in real or simulated trading is a plus).
Technical background (Maths, Physics, Engineering, Econometrics, Quant Finance…",3+ years,DA VINCI DERIVATIVES,Amsterdam,2 days ago
Contract Analyst,"Bachelor’s degree or equivalent.
Advise management of contractual rights and obligations; compile and analyse data and maintain historical information.","Bachelor’s degree or equivalent.
Advise management of contractual rights and obligations; compile and analyse data and maintain historical information.",3-6 years,Medtronic,Nederland,1 day ago
"Data Analyst, Check-out and Payments","You have affinity for data mining in large scale retail environments or similar.
At least 3 years' work experience in a similar analyst role preferably within…","You have affinity for data mining in large scale retail environments or similar.
At least 3 years' work experience in a similar analyst role preferably within…",1-3 Years,Action,Nederland,5 days ago
Make-Up Artist / Visagist,Voor meerdere opdrachtgevers waaronder Estee Lauder MAC & L’Oreal Luxe zijn wij op zoek naar ervaren Make-Up ARTists.,Voor meerdere opdrachtgevers waaronder Estee Lauder MAC & L’Oreal Luxe zijn wij op zoek naar ervaren Make-Up ARTists.,2 years,Zeelz,Nederland,3 weeks ago
Cloud Spend Analyst,"Which enable data-led decisions.
We may ask you to travel occasionally to one of our offices (or a customer site) for specific meetings or team building/social…","Which enable data-led decisions.
We may ask you to travel occasionally to one of our offices (or a customer site) for specific meetings or team building/social…",5+ years,Cloud Technology Solutions,Newport,2 weeks ago
Investment analyst,"Prior experience with due diligence and/or deal structuring is preferred, as well as experience in the agriculture and/or cleantech domain.","Prior experience with due diligence and/or deal structuring is preferred, as well as experience in the agriculture and/or cleantech domain.",2 years,Innovation Industries,Eindhoven,3 weeks ago
