WEB RESEARCH AND DATA ANALYST,"You have a Master in Statistics or Master in Economics with a data specialty.
You are responsible for online European Retail surveys, online European Retail…","You have a Master in Statistics or Master in Economics with a data specialty.
You are responsible for online European Retail surveys, online European Retail…",3 years,Cross-Border Commerce Europe,Brussels,2 weeks ago
Consultant Data Engineer,"You have 1-3 years of relevant experience in Data, DevOps, Cloud or Software Engineering.
Python programming: development of server-side tools (bulk data…","You have 1-3 years of relevant experience in Data, DevOps, Cloud or Software Engineering.
Python programming: development of server-side tools (bulk data…",4 years,Sia Partners,Brussels,2 weeks ago
Analyst Intern - Brussels (2023),"Creating dynamic visualizations to rapidly explore data and models.
Developing data analyses using statistical methods and analytical tools including…","Creating dynamic visualizations to rapidly explore data and models.
Developing data analyses using statistical methods and analytical tools including…",5 years,"Analysis Group, Inc.",Brussels,1 month ago
Customer Data Engineer,"You have a masters degree in Engineering and/or Computer Science or equivalent, and 3+ years of relevant experience.
Anytime, on any device and in real-time.","You have a masters degree in Engineering and/or Computer Science or equivalent, and 3+ years of relevant experience.
Anytime, on any device and in real-time.",6 years,Factry,Ghent,1 month ago
Graduate Engineer - Belgium - 2023,"As part of our career development system, a next role after 2 or 3 years may be deepening your skills in another technical or project role, a more “coordinating…","As part of our career development system, a next role after 2 or 3 years may be deepening your skills in another technical or project role, a more “coordinating…",7 years,ExxonMobil,Antwerp,2 weeks ago
Data engineer,"You are responsible for the implementation and maintenance of the Data Warehouse and ETL infrastructure, where you will transform data into useful data formats…","You are responsible for the implementation and maintenance of the Data Warehouse and ETL infrastructure, where you will transform data into useful data formats…",8 years,Tripwire Solutions,2650 Edegem,3 weeks ago
Senior Digital ASIC DFT engineer,Take the responsibility for the DFT aspect of large hierarchical designs.,Take the responsibility for the DFT aspect of large hierarchical designs.,9 years,Qplox Engineering,Leuven,1 week ago
Machine Learning Engineer,You could also have a long background in software development & devops and passion for data science projects or be a Full-stack Data Scientists with solid…,You could also have a long background in software development & devops and passion for data science projects or be a Full-stack Data Scientists with solid…,5 years,Solita,Belgium,6 days ago
Business Analyst,"A bachelor's or master's degree in a financial economics or engineering discipline.
Prior experience as a business analyst in an IT environment.","A bachelor's or master's degree in a financial economics or engineering discipline.
Prior experience as a business analyst in an IT environment.",3 years,Ordina,Mechelen,1 week ago
Data Engineer,"Experience in data visualization solutions and techniques.
Experience with banking companies or other financial institution.","Experience in data visualization solutions and techniques.
Experience with banking companies or other financial institution.",4 years,HNM Solutions,Remote in Brussels,3 weeks ago
DevOps Engineer (Data),"You understand the needs of the customer and work with software engineers, architects, solution analysts,...
You will guide and advise your customers in the end…","You understand the needs of the customer and work with software engineers, architects, solution analysts,...
You will guide and advise your customers in the end…",5 years,Ordina,Mechelen,4 weeks ago
Junior Analyst (F/M/X),"Fluent in French and/or Dutch, good knowledge of the other language.
We will define a plan to maximise your potential through training, certification or skills…","Fluent in French and/or Dutch, good knowledge of the other language.
We will define a plan to maximise your potential through training, certification or skills…",6 years,Acensi,Brussels,3 weeks ago
Graduate Engineer - Homologation with focus on New Mobility,"Master in Automotive, Mechanical, Electrical or Mechatronics engineering with some expertise in data & document management (setup processes and databases).","Master in Automotive, Mechanical, Electrical or Mechatronics engineering with some expertise in data & document management (setup processes and databases).",7 years,Toyota Motor Europe,1930 Zaventem,1 week ago
EMEA Engineering Discipline Leader,"Bachelor’s degree in a related field or equivalent experience.
Develop plans and deliver results in a fast-changing business or regulatory environment, while…","Bachelor’s degree in a related field or equivalent experience.
Develop plans and deliver results in a fast-changing business or regulatory environment, while…",8 years,Cargill,Remote in Vilvoorde,2 weeks ago
DATA ANALYST,"Je hebt reeds enkele jaren ervaring met het verzamelen en analyseren van grote hoeveelheden data.
Goede communicatievaardigheden en het vermogen om complexe…","Je hebt reeds enkele jaren ervaring met het verzamelen en analyseren van grote hoeveelheden data.
Goede communicatievaardigheden en het vermogen om complexe…",9 years,Eyetech Solutions,Ghent,2 weeks ago
ICT Service Engineer,He/she ensures that the Vynckeneers can concentrate on their tasks with a minimum of ICT-worries and supported by the right tools.,He/she ensures that the Vynckeneers can concentrate on their tasks with a minimum of ICT-worries and supported by the right tools.,5+ years,VYNCKE,Belgium,2 weeks ago
Young talent program life sciences,You have just obtained a bachelor’s or master’s degree (or you will receive it this year) in a life sciences or engineering area.,You have just obtained a bachelor’s or master’s degree (or you will receive it this year) in a life sciences or engineering area.,3 years,MindCapture,Belgium,2 weeks ago
Junior Developer / Analyst (m/f/x),"The Belgian branch, located in the center of Brussels, is actually looking for a Developer/Analyst (m/v/x) Responsabilities - Maintain and enhance the fresh our…","The Belgian branch, located in the center of Brussels, is actually looking for a Developer/Analyst (m/v/x) Responsabilities - Maintain and enhance the fresh our…",1 year,ARAG SE,Brussels,6 days ago
Digital data analyst,"You create and automate digital reporting and manage the quality of the data and reports (within the predefined data management architecture, in close…","You create and automate digital reporting and manage the quality of the data and reports (within the predefined data management architecture, in close…",5+ years,Telenet,Mechelen,2 hours ago
"Intelligence, intern","You can also add relevant piece of work (master thesis or other elements) demonstrating your data management/analysis, analytical, or writing skills.","You can also add relevant piece of work (master thesis or other elements) demonstrating your data management/analysis, analytical, or writing skills.",3+ years,Hydrogen Europe,Brussels,2 days ago
Production worker industrial bakery,"Registering data for production monitoring Pass on the information to the data subjects.
Check the supply of machines or installations and the flow of raw…","Registering data for production monitoring Pass on the information to the data subjects.
Check the supply of machines or installations and the flow of raw…",5+ years,Country Style Foods (Europe),3920 Lommel,3 days ago
Research intern – 2023,"Recent graduate or in final stages of their MASTER studies in Political science, economics or law (including intellectual property); preferably with the…","Recent graduate or in final stages of their MASTER studies in Political science, economics or law (including intellectual property); preferably with the…",3 years,KEA European Affairs,1050 Bruxelles Ixelles,2 days ago
Data Administrator,Dan is een functie als Data Administrator jouw ding!,Dan is een functie als Data Administrator jouw ding!,5+ years,Zorgbedrijf Antwerpen,2018 Antwerp,2 weeks ago
Entry Level CRA,"Minimum Bachelor of Science in Health or Life Science related field.
Medical device and/or investigational product/drug accountability and inventory;","Minimum Bachelor of Science in Health or Life Science related field.
Medical device and/or investigational product/drug accountability and inventory;",3 years,"Medpace, Inc.",3001 Leuven,2 hours ago
"Customer Care Coordinator Antwerp, Belgium Consumer","2 years plus experience in customer service or B2C role.
Analytical mindset where you can develop actionable measures from data results.","2 years plus experience in customer service or B2C role.
Analytical mindset where you can develop actionable measures from data results.",1 year,Philip Morris International,Remote in Antwerp,2 days ago
3D Artist,"Als 3D artist sta je mee in voor het uitwerken van ontwerpen en concepten.
Materiaalkennis- en voeling zijn hierbij van groot belang.","Als 3D artist sta je mee in voor het uitwerken van ontwerpen en concepten.
Materiaalkennis- en voeling zijn hierbij van groot belang.",5+ years,M2 Architecten,Antwerp,2 weeks ago
3D Artist Exterieur,"Speelt een leidende rol in de vastgoedsector, door zijn hoogwaardige 3D-beelden en de totale aanpak van projectcommunicatie.","Speelt een leidende rol in de vastgoedsector, door zijn hoogwaardige 3D-beelden en de totale aanpak van projectcommunicatie.",3+ years,Nanopixel,8800 Roeselare,2 weeks ago
Accounts Payable Clerk (Entry Level Opportunity),"Manage our vendor data (names, addresses, etc.), validate and get approval for new accounts, and maintain our audit record of vendor data changes and approvals.","Manage our vendor data (names, addresses, etc.), validate and get approval for new accounts, and maintain our audit record of vendor data changes and approvals.",5+ years,Canonical - Jobs,Remote in Brussels,2 days ago
Application Engineer BNL ‏ (M/F/X),Degree (or equivalent) qualified in engineering/science discipline with experience in engineering service environment or related experience in adhesive…,Degree (or equivalent) qualified in engineering/science discipline with experience in engineering service environment or related experience in adhesive…,3 years,Henkel,Brussels,2 weeks ago
Graduate Engineer,"Externe stakeholders: klanten, leveranciers, (sub)contractoren, ...
Contract management : ook contracten dienen beheerd te worden - je vraagt zo offertes aan,…","Externe stakeholders: klanten, leveranciers, (sub)contractoren, ...
Contract management : ook contracten dienen beheerd te worden - je vraagt zo offertes aan,…",5+ years,Catalay,Antwerp,2 hours ago
Project Analyst - Tester,"En tant que Project analyst, vos principales responsabilités sont les suivantes :
Rejoindre une organisation durable, dynamique, et en pleine croissance,.","En tant que Project analyst, vos principales responsabilités sont les suivantes :
Rejoindre une organisation durable, dynamique, et en pleine croissance,.",3 years,Paradigm,Brussels,3 days ago
Supply Chain Internship,"Vente-privee.com processes the collected data to handle the recruitment process, to evaluate your ability to carry out the job offered and your professional…","Vente-privee.com processes the collected data to handle the recruitment process, to evaluate your ability to carry out the job offered and your professional…",1 year,Veepee,Bruxelles-Capitale,2 weeks ago
BUSINESS ANALYST (Remote),"We hebben momenteel een leuk en uitdagende REMOTE opdracht heb voor een sterke Business Analyst.
Deze Business Analyst zal nauw samenwerken met de Data…","We hebben momenteel een leuk en uitdagende REMOTE opdracht heb voor een sterke Business Analyst.
Deze Business Analyst zal nauw samenwerken met de Data…",5+ years,Eyetech Solutions,Remote in Brussels,7 days ago
Senior Policy Analyst: Circular Economy,"The successful candidate will have a proven track record of effective project delivery, experience in fundraising, excellent command of English and ideally a…","The successful candidate will have a proven track record of effective project delivery, experience in fundraising, excellent command of English and ideally a…",3+ years,The Institute for European Environmental Policy...,Brussels,3 hours ago
CE drivers,"Recording follow-up and activity data.
Picking up, transporting and delivering products or goods.
Organising or checking the loading of goods in the vehicle.","Recording follow-up and activity data.
Picking up, transporting and delivering products or goods.
Organising or checking the loading of goods in the vehicle.",5+ years,Van Dievel,2800 Mechelen,2 days ago
Data Engineer (m/f/x),"Work with data and analytics experts to strive for greater functionality in our data systems.
Development of an ETL process that allows integrating data from…","Work with data and analytics experts to strive for greater functionality in our data systems.
Development of an ETL process that allows integrating data from…",3 years,GHOST-Bikes GmbH,Homeoffice,1 day ago
(Junior) Data Engineer (m/w/d),"Die nachhaltige Veränderung von Unternehmen ist unsere Kernkompetenz.
Zur Komplettierung unserer Teams suchen wir Dich als (Junior) Data Engineer (m/w/d).","Die nachhaltige Veränderung von Unternehmen ist unsere Kernkompetenz.
Zur Komplettierung unserer Teams suchen wir Dich als (Junior) Data Engineer (m/w/d).",1 year,nexpert AG,Homeoffice,2 weeks ago
ASIC Design Engineer,"Relevant experience can be obtained through schoolwork, classes and project work, internships, and/or work experience.","Relevant experience can be obtained through schoolwork, classes and project work, internships, and/or work experience.",5+ years,INTEL,München,3 days ago
Junior Project Manager,"Assist the stakeholders in conduction UAT,manage the escalations from business,identify project risks and working with the Project team on response strategies.","Assist the stakeholders in conduction UAT,manage the escalations from business,identify project risks and working with the Project team on response strategies.",3+ years,Ubique Systems,Berlin,2 weeks ago
"Project Manager, EMEA","Experience as a Project Manager/Specialist or in a similarly technical or project management-type role.
To be the main point of contact for implementing clients…","Experience as a Project Manager/Specialist or in a similarly technical or project management-type role.
To be the main point of contact for implementing clients…",5+ years,Digital Science,Homeoffice,2 days ago
Junior Financial Analyst,"Requirements: - Ongoing/complete Bachelor’s or Master’s degree in Finance or Real Estate.
What you will be doing: - Executing financial analyses and conducting…","Requirements: - Ongoing/complete Bachelor’s or Master’s degree in Finance or Real Estate.
What you will be doing: - Executing financial analyses and conducting…",3 years,Eyzenberg & Company,Homeoffice,1 week ago
Project Manager Generative AI (f/m/x),"Experience in building strong project initiatives and executing their mission.
Project management, ideally leadership experience with diverse project teams.","Experience in building strong project initiatives and executing their mission.
Project management, ideally leadership experience with diverse project teams.",1 year,BMW,München,7 days ago
Working student (f/m/d) Data Engineer,"Experience with ETL/ELT tools for data integration is a plus.
If you are also interested in or already have experience with railroad projects, you are the ideal…","Experience with ETL/ELT tools for data integration is a plus.
If you are also interested in or already have experience with railroad projects, you are the ideal…",5+ years,Siemens,13629 Berlin,2 days ago
Electrical/Mechanical Engineer – R&D graduate entry (m/f/d),"Develop mechanical components or electronic modules, design electronic circuitsor embedded software.
Design new user interface concepts for IoT devices or…","Develop mechanical components or electronic modules, design electronic circuitsor embedded software.
Design new user interface concepts for IoT devices or…",3+ years,Procter & Gamble,Kronberg,2 weeks ago
Senior IT Project Manager (f|m|x),"Using modern project methods, some of them agile, in all project phases, you supervise and manage a national/international project team.","Using modern project methods, some of them agile, in all project phases, you supervise and manage a national/international project team.",5+ years,ACTICO,Homeoffice,2 weeks ago
Project Lead / Design Manager - Data Center (m/f/d),"You will ideally have a background as an engineer in building services, HVAC, architect or project manager with at least 10 years of experience.","You will ideally have a background as an engineer in building services, HVAC, architect or project manager with at least 10 years of experience.",3 years,Arup,Homeoffice in Frankfurt am Main,1 week ago
IT Project Manager,"A basic understanding of Lucene based search platforms as Elasticsearch or Apache Solr.
Collaborating with software developers, product managers, QA and DevOps…","A basic understanding of Lucene based search platforms as Elasticsearch or Apache Solr.
Collaborating with software developers, product managers, QA and DevOps…",4 year,Digital Science,Homeoffice,2 weeks ago
Partnerships Project Manager,Bachelor’s and/or Master’s in Management or any related field; or equivalent related professional Leadership experience in a product development or product…,Bachelor’s and/or Master’s in Management or any related field; or equivalent related professional Leadership experience in a product development or product…,5 year,TUI,Zum Teil im Homeoffice in Deutschland,2 weeks ago
Junior Data Analyst (m/w/d) - remote deutschlandweit,"Als Preismarktführer mit einem extrem großen Produktsortiment wachsen wir rasant.
Der wichtigste Grund für unseren stetigen Erfolg sind jedoch unsere über 500…","Als Preismarktführer mit einem extrem großen Produktsortiment wachsen wir rasant.
Der wichtigste Grund für unseren stetigen Erfolg sind jedoch unsere über 500…",6 year,WIRmachenDRUCK GmbH,"Belgium, Germany, Netherlands, Poland, UK",2 days ago
Content Writer (m/w/d),"Übersetzung bestehender Texte vom Englischen ins Deutsche.
Sicherstellung der Konsistenz in allen deutschen Kommunikationsformaten.","Übersetzung bestehender Texte vom Englischen ins Deutsche.
Sicherstellung der Konsistenz in allen deutschen Kommunikationsformaten.",1 year,DataGuard,"Belgium, Germany, Netherlands, Poland, UK",2 weeks ago
Marketing Analyst (m/f/d),"German or Austrian residency and EU work permit is required.
Build our marketing intelligence infrastructure by setting up our data warehouse.","German or Austrian residency and EU work permit is required.
Build our marketing intelligence infrastructure by setting up our data warehouse.",2 years,WBS Gruppe,Homeoffice,3 days ago
Project Manager (f/m/d) Corporate Strategy,"You initiate and coordinate corporate initiatives and programs and provide content for their communication.
Excellent know-how in consulting/strategic project…","You initiate and coordinate corporate initiatives and programs and provide content for their communication.
Excellent know-how in consulting/strategic project…",3 years,Siemens,80333 München,1 week ago
DIGITAL PROJECT MANAGER (M/W/D),"Experience in project coordination or eCommerce logistics, ideally in a direct-to-consumer industry.
Review Power Bi report daily for any delayed omnichannel…","Experience in project coordination or eCommerce logistics, ideally in a direct-to-consumer industry.
Review Power Bi report daily for any delayed omnichannel…",4 years,Louis Vuitton,München,2 days ago
(JUNIOR) PROJECT MANAGER FOCUS ON EVENT OPERATIONS (M/W/D).,"Unser Herz brennt für strategisches Consulting und innovative Event-Konzepte.
Unsere rund 110 Mitarbeiter konzipieren digitale, hybride und Live-Meetings,…","Unser Herz brennt für strategisches Consulting und innovative Event-Konzepte.
Unsere rund 110 Mitarbeiter konzipieren digitale, hybride und Live-Meetings,…",5 years,Proske GmbH,"Belgium, Germany, Netherlands, Poland, UK",3 days ago
Data Engineer (m/w/d) 100 % Remote,You scrutinise the existing data processing processes and data structures (data warehouses/data lakes) and contribute your ideas for improvement.,You scrutinise the existing data processing processes and data structures (data warehouses/data lakes) and contribute your ideas for improvement.,6 years,Cloudrizon GmbH,Homeoffice in Ulm,3 hours ago
Marketing Analyst (m/f/d),"Build our marketing intelligence infrastructure by setting up our data warehouse.
At least 2+ years of experience as Marketing Analyst or Business Analyst.","Build our marketing intelligence infrastructure by setting up our data warehouse.
At least 2+ years of experience as Marketing Analyst or Business Analyst.",7 years,WBS CODING SCHOOL,Homeoffice,6 days ago
Data Analyst (w/m/x),"Ihr Fokus liegt dabei im Cluster Data Analytics.
Zusammen mit den späteren Anwendern gestalten Sie Data Analytics Anwendungen zur Analyse und Vereinfachung von…","Ihr Fokus liegt dabei im Cluster Data Analytics.
Zusammen mit den späteren Anwendern gestalten Sie Data Analytics Anwendungen zur Analyse und Vereinfachung von…",8 years,BMW,Regensburg,2 weeks ago
Working student (f/m/d) in project management coordination incl. data and documentation management,"Current studies in project management, IT engineer, economy or comparable.
First IT and project management knowledge.
How You’ll Make an Impact.","Current studies in project management, IT engineer, economy or comparable.
First IT and project management knowledge.
How You’ll Make an Impact.",9 years,Siemens Energy,60528 Frankfurt am Main,3 days ago
Technical Project Manager (m/f/d),"Take the lead on the technical conversations with our data source partners.
Experience integrating and maintaining SAP and/or Salesforce Commerce Cloud…","Take the lead on the technical conversations with our data source partners.
Experience integrating and maintaining SAP and/or Salesforce Commerce Cloud…",5 years,Productsup,Homeoffice in 10178 Berlin,1 week ago
Customer Success Manager – Remote or Berlin,"Founded experience working in a Customer Success, Account Management, or another client-facing role.
Build relationships with customers to understand their…","Founded experience working in a Customer Success, Account Management, or another client-facing role.
Build relationships with customers to understand their…",3 years,Mentor Talent,Homeoffice,2 days ago
(Junior) Data Engineer (w/m/d),Wir sind ein interdisziplinär aufgestelltes Team und führen selbstorganisiert und agil Beratung auf Basis der Digitalisierungsstrategien durch.,Wir sind ein interdisziplinär aufgestelltes Team und führen selbstorganisiert und agil Beratung auf Basis der Digitalisierungsstrategien durch.,4 years,Deutsche Bahn AG,60486 Frankfurt am Main,1 week ago
Senior Project Manager - Data Centre,"Have experience project managing on a data centre project.
Have a degree or comparable experience in a project management or construction discipline.","Have experience project managing on a data centre project.
Have a degree or comparable experience in a project management or construction discipline.",5 years,Linesight,Deutschland,2 days ago
FTTx Project Manager,"Strong ability to develop and maintain project plans & financial plans.
Oversee or delegate day-to-day operations, assign and track performance goals, while…","Strong ability to develop and maintain project plans & financial plans.
Oversee or delegate day-to-day operations, assign and track performance goals, while…",6 years,Connect44,Homeoffice in Düsseldorf,1 day ago
Corporate Analyst - Explorer Graduate Programme - 2023,"Be motivated with a strong degree or expected degree – in any area.
Our Corporate Banking team helps large-scale, multinational organisations succeed and grow.","Be motivated with a strong degree or expected degree – in any area.
Our Corporate Banking team helps large-scale, multinational organisations succeed and grow.",7 years,Barclays,Frankfurt am Main,1 week ago
Project Manager (m/w/d) Souveränes Europa,"Die Bertelsmann Stiftung ist eine der größten operativen Stiftungen in Europa.
Auf der Basis dieser Analyse werden Handlungsempfehlungen zur Weiterentwicklung…","Die Bertelsmann Stiftung ist eine der größten operativen Stiftungen in Europa.
Auf der Basis dieser Analyse werden Handlungsempfehlungen zur Weiterentwicklung…",8 years,Bertelsmann Stiftung,10115 Berlin,3 hours ago
Operations/ Project Manager,The remuneration for the position includes a shares package.,The remuneration for the position includes a shares package.,9 years,VaRc Gmbh,Vorübergehend im Homeoffice in Berlin,1 week ago
PagoNxt: Data Business Analyst,"University degree in computer science, engineering or mathematics or equivalent work experience.
Responsible for various aspects of KPI data analysis, research,…","University degree in computer science, engineering or mathematics or equivalent work experience.
Responsible for various aspects of KPI data analysis, research,…",5+ years,Santander,Deutschland,2 days ago
