Job Role,Job description,Required skills,Years of experience required,Company name,Location,Date posted
Senior Toxicologist,The individual will be responsible for running and over-seeing in-vivo studies in the for programs that target immunotherapeutics against infectious diseases and cancer. They will also be integral for providing toxicology expertise for ongoing pre-clinical developments as well as devising a strategy for compound development.,"Toxicology expertise, Regulatory knowledge, Data analysis and interpretation, Project management, Communication, Budget management, Flexibility",2-5 years,Discover International,"Germany, Belgium, Netherlands or Switzerland",1 week ago
Technical Implementation Lead O2C/3DC Nordics,"You will be responsible to create a basis to seamlessly onboard our new clients into our organization. You will be leading a team of professional implementation managers across the Scandinavian countries. You will be the one to lean on when the wind gets windier, the enabler and the one who is the first to praise others when achievements are conquered.","Technical implementation expertise, Leadership skills, Business acumen, Knowledge transfer and standardization, Customer engagement, Communication skills, Industry experience, Event participation",0 year,Riverty,"Sweden (Varberg, Uppsala or Stockholm) or Norway (Oslo, Rörvik or Sandefjord)",4 weeks ago
Founders' Associate,The responsibilities you own will directly contribute to shaping a brand new category of technology for the shipping industry and preventing greenhouse gas emissions from entering the atmosphere.,"Creative Problem Solving, Attention to Detail, Business Development, Communication Training, External Communications, Management Consulting, Operations, Oral Communication, Problem Solving, Timelines",2-4+ years,Seabound,"London, England, United Kingdom Remote",3 weeks ago
Climate Strategy and Development,Identify and develop business cases for new technical and commercial solutions based on carbon market trends and movements,"Build Strong Relationships, Business Case Preparation, Carbon Credits, Carbon Markets, Coaching & Mentoring, Lead Qualification, Market Analysis, Negotiation, Problem Solving, System Performance",1 year,Patch,"London Area, United Kingdom Remote",1 week ago
Data Researcher,Support the team with answering data queries and updating records as required,"Analytical Skills, Communication, Data Analysis, Microsoft Excel, Statistics, Data Collection, Data Entry, English, Problem Solving, Site Management",1 year,Unison Site Management,"Madrid, Community of Madrid, Spain Remote",2 days ago
Business Analyst,"Create and execute test scenarios to make sure that the implemented functionalities work as expected and meet the customer requirements; Deliver trainings for clients and their end-users on basic use of the system, the newly implemented functionalities, etc.; Frequent travel or occasional spending of time at customers’ offices may be required for some of the clients.","Analytical Skills, Business Analysis, Requirements Gathering, Business Process, Business Requirements, Finance, Mobile Application Part (MAP), Problem Solving, Test Scenarios, User Acceptance Testing",3+ years,RIR | Radioactive International Recruitment Ltd,"Sofia, Sofia City, Bulgaria Remote",1 week ago
Senior Customer Success Engineer Energy Solutions m/f/d,"Deep, technical understanding of Energy Storage Systems and lithium-ion batteries","Communication, Customer Experience, Customer-focused Service, Enablement, Energy Storage, Organization Skills, Storage Systems, Technical Enablement, Technical Support, Technical Understanding",5+ years,TWAICE,Germany Remote,6 days ago
Global Strategic Sourcing Manager – Flexible Packaging,"Leads negotiations with global suppliers, selecting the appropriate path to market for flexible packaging as set by the category strategy and in tandem with regional commercial buyers.","Flexible Packaging, Global Sourcing, Performance Reporting, Recycling, Stakeholder Management, Strategic Sourcing, Supplier Management, Supplier Negotiation, Supplier Performance, Supplier Relationship Management",7 years,Mars,"Aimargues, Occitanie, France Remote",2 days ago
Business Development Lead,"We are looking for an open-minded and motivated business development professional who takes initiative and produces results. Ideally, you would have a strong background in business development and customer success, additionally some experience with marketing.","Account Management, Business Development, Commodities, Derivatives, Development Strategy, Market Research, New Business Development, New Leads, Relationship Building, Reliability",1 year,Atem,Germany Remote,1 day ago
Senior Software Engineer,Have experience across more than one language and are comfortable working with new tech. (experience in Python is essential plus JavaScript (React framework) and Java ideally),"JavaScript, Programming, .NET Framework, API Development, Back-End Web Development, Bid Processes, Code Review, Distributed Systems, Front-End Development, Software Architecture",2 year,Helyx,United Kingdom Remote,5 days ago
Portuguese Polish IT Support Analyst,"L-1 troubleshooting experience across Microsoft Operating Systems including Windows 7, Win10, MS Exchange /Outlook environments and browser functions, Experience is providing application L-1 support using standard operating procedure instructions","Airline Ticketing, English, Event Ticketing, Incident Management, Portuguese, ServiceNow, Standard Operating Procedure (SOP), Technical Support, Ticketing Systems, Troubleshooting",1 year,Kouegoue Technology Global,Poland Remote,3 weeks ago
Tech AI Talent Hunter,"Manage full-cycle recruitment processes in several technical and corporate areas reaching out to the best candidate; Manage a talent pool and the relationship with professionals; Maintain close communication with hiring managers throughout the recruitment cycle to understand the position, team needs, culture, and values; Contribute ideas to improve our processes, employer brand, and hiring strategy","Communication, Research, Business Development, Candidate Experience, Cybersecurity, English, Hunter, Negotiation, Penetration Testing, Social Media",5+ years,Summ.link,"Ghent, Flemish Region, Belgium Remote",2 weeks ago
Senior Data Analyst,"Create new Explores to enable non-technical analysts to access data, build dashboards, and solve critical business challenges on Looker technology","AWS or Google cloud technologies (Redshift or BigQuery), Python, Looker and LookML, Tableau, PowerBI, Business Objects, MicroStrategy or other BI tools",3+ years,Tillster,Portugal,3 weeks ago
Full-stack Developer (React/Node) - EU Remote Jobs,Looking for a talented developer,"software development experience, JavaScript (Core, DOM APIs), Node.js and React.js, Typescript, AWS, GOF patterns, Strong organizational skills, Soft skills — we value clear and effective communication, at the same time don’t force you becoming a public speaker",5+ years,Lemon.io,"Canada, Europe, LATAM, UK, Ukraine",1 week ago
Senior Frontend Engineer - EU Remote Jobs,We are looking for a Senior React Engineer to join our core Engineering team,"JavaScript, jobs in crypto, React, Typescript",3 years,Pooky,"Europe, UK",2 weeks ago
(Senior) HR Project / Program Manager m/f/d - Remote,"Select and manage ongoing relationships with external contractors so that the organization receives satisfactory standards of service. Lead, direct, evaluate, and develop a team of project managers to ensure that projects are completed on-time, within budget and according to project specifications","project and/ or program management and related experience, HR Transformation Project, Project Management Professional (PMP), Excellent analytical skills, Strong interpersonal skills and extremely resourceful, Competency in Microsoft applications including Word, Excel, and Outlook",5-8 years,Xylem,"Europe, UK, US",2 weeks ago
Digital Analyst (f/m/x) - EU Remote Jobs,"Demonstrate your capacity to consult various stakeholder groups independently and confidently, Show deep understanding of business goals and converting them into data collection requirements / specifications, Handle and transform data, analyse data, validate data and visualize data to reveal value-adding insights","PowerBI, Google Analytics, SQL, Python/PySpark/Pandas, or similar), Google Tag Manager, Digital Analytics focused on Lead Generation, e-Commerce and/or CRO, A/B testing strategy & methodologies, DAX",1 year,Mercedes Benz,Portugal,1 week ago
Legal & Procurement Business Partner - EU Remote Jobsness-partner/,"Advise on corporate and commercial law, EU grant management framework, employment law, contracts, data protection, procurement, conflicts of interest, ethics, anti-fraud, non-profit requirements and operations.","Communication, cross cultural understanding and empathy, planning and budgeting, Problem-solving attitude, organisational skills and ability to drive compliance, legal, procurement and/or non-profit strategy implementation steps and tangible outcomes, Ability to build and maintain relationships at all levels in a complex, multi-country, multi-stakeholder, multi-entity organisation",1-2/2-3 years,EIT Climate KIC,"Belgium, Germany, Netherlands, Poland, UK",3 weeks ago
"Anti-Money Laundering, Financial Crime Investigator - EU Remote Jobs","Investigating alerts (we call them tasks) raised by our transaction monitoring systems, analysing customer accounts to identify risk or suspicious activity, and recording your decisions in a clear and concise rationale","experience working in operational financial crime, International Compliance Association (ICA), Association of Certified Anti-Money Laundering Specialists (ACAMS) or an equivalent body",1 year,Monzo Bank,"Remote, UK",2 weeks ago
"Revenue Accounting & Commercial Controllership Manager, EMEA - EU Remote Jobs","Develop collaborative, responsive relationships with regional operating leaders in Sales, Commercial Operations and R&D and be their primary point of contact to navigate revenue related Finance matters","revenue recognition experience (multiple element arrangements with SaaS), entrepreneurial spirit and highly responsive customer service mindset, Superb attention to detail, strong planning and organization skills, and the ability to multi-task, prioritize and deliver in a fast-paced, dynamic environment",6-8 years,Axon,"Germany, Netherlands, UK",2 weeks ago
Merger and Acquisition Specialist - EU Remote Jobs,"Monitor the best acquisition opportunities on the market, contact and qualify websites/companies owner(s), organize meetings with high-level team members","M&A transaction execution, business development and growth, communication skills, organizational skills, CRMs, iGaming, Crypto, Media & emerging tech markets",2 years,Find.co,"Europe, UK",1 month ago
E-Learning Specialist (Flex/Remote),Carry out an objective evaluation of the effectiveness of training programs through performance-based measurement assessment and feedback analysis.,"360Learning, Genially, or any other LMS too",3 years,Scaleway,"France, Worldwide",1 month ago
Product Analyst - Casual Games - EU Remote Jobs,"Analyse data to quantify the relationships between game elements, player engagement and marketing strategies, using statistical analysis and data visualisations","Python for data analysis and visualisation, SQL, Tableau, Strong communication skills through comprehensive reporting and presentations",1 year,Kwalee,"Europe, UK",2 weeks ago
Senior reporter - EU Remote Jobs,"You’ll be writing quick turnaround news stories and longer analytical pieces, hunting down scoops and delving into company accounts. You’ll star in our weekly podcast, and moderate online and in-person panel discussions hosted by Sifted","journalism , comfortable writing in a variety of formats, from news to features to data stories, hosting virtual and in-person events, and excited to work in an environment where things move fast and often change",3 years,Sifted,"Europe, UK",3 weeks ago
Scrum Master - EU Remote Jobs,We are looking for an Agile Coach / Scrum Master to join our early-stage FinTech!,"Scrum, Kanban, Jira/Confluence power user. JQL, empathy and situational awareness,",5+ Years,Paytrix,"Ireland, Poland, Portugal, UK",1 week ago
Product Specialist - EU Remote Jobs,"Being active on social media by posting regularly to position yourself as a subject matter expert, connecting and following prospects and provide value where possible","Life Sciences industry in a consulting position, software solutions in the Life Sciences industry, sales processes, empathy for peers, direct reports, and customers, communication skills and the ability to motivate behavior change",3+ years,Scilife,Europe,6 days ago
Strategy Finance Manager / Associate - EU Remote Jobs,"key part of many strategic projects, M&A, fundraising, Long term business planning, new product business cases, equity raise, IPO preparation and generally supporting the CFO and management in the strategy development of the company","banking, transaction services, private equity, venture capita, equity research or investment banking or consulting, Strong analytical skillset, financial and data management skills, including strong PowerPoint and Excel skills, excellent planning, organizational skills, excellent attention to detail and strive for continuous improvement",3-6 years,GoStudent,"Austria, Bulgaria, France, Germany, Greece, Italy, Netherlands, Poland, Spain, Turkey, UK",1 week ago
UX Researcher - EU Remote Jobs,"Partner with UX designers, product managers and the development team, using a blend of design thinking and UX research approaches to iteratively enhance Elastic products","Deep experience within UX research, quantitative and qualitative user research, SaaS platforms and customers, dense data-sets, analytics and telemetry, in-depth customer interviews, design, product and development teams",1-3 Years,Elastic,"Austria, Belgium, Denmark, Greece, Hungary, Ireland, Italy, Luxembourg, Malta, Norway, Poland, Romania, Slovenia, South Africa, Spain, Sweden",3 weeks ago
Technical Project Manager (Spain) - EU Remote Jobs,"Participate in implementation client-facing kick-offs, requirement gathering sessions and configuration review meetings","software implementation, customer service and/or transferable experience, collaboration, negotiation and diplomacy, managing multiple high priority projects simultaneously and successfully",2 years,Emburse,Spain,4 weeks ago
Business Analyst (OMS focused) - EU Remote Jobs,"On a day-to-day basis, you will be the one to oversee the bigger picture, work closely with your team on crafting, pitching, and delivering an appropriate solution, and support the client in the creation of roadmaps and product backlogs. You will be part of a multidisciplinary, agile scrum team, that consists of people at Valtech’s side, as well as the client’s.",", optimising e-commerce and large-scale digital experience platforms, such as Sitecore, Adobe Experience Manager, or Episerver/Optimizely, we-before-me mindset, always keen to celebrate successes together",5+ years,Valtech,"Denmark, France, Germany, Netherlands, Sweden, Switzerland, UK, Ukraine",3 weeks ago
Intelligence Data Analyst and Support Assistant Manager,"Loves to use data and undertakes analysis of data to identify trends and emerging threats and disseminate/present findings to internal and external customers,…","linux/unix, network monitoring, incident response, systems administration, security accessment",2 years,Lloyds Banking Group,Hybrid remote in London,1 week ago
Junior Data Analyst,"Involvement in a broad range of tangential projects which may be integrated with or benefit the RM service.
General Support (Customer Assurance data support).","Enterprise Solutions Architecture, business inteligence, reports, reporting",2 years,CONTEXT WORLD,Remote,2 weeks ago
Reporting & Insights Analyst,Your primary responsibility will be translating large quantities of data from a wide and varies set of data sources and complex systems.,"Analyst, Business Analyst, Business Requirements, Consulting, Development, Lifecycle, Management, MS Office, Project, Testing",2 years,Heineken,Remote,2 weeks ago
Data Analyst Intern,"Draw system data from multiple sources into excel or other suitable tool.
Interpret and present data from the reports to key stakeholders.","Configuration Management, Developer, Linux, Management, Process Engineering, VMware",2 years,Bombardier,London,2 weeks ago
Data Analyst,"Owning projects from scope through to delivery.
Experience using Tableau /or Power BI and writing SQL queries.
Pace, agility, and innovative thinking.","FICO, AR, AP, Asset Management, HAHA",2 years,ASDA,Hybrid remote in Leeds LS11,2 weeks ago
Data Services Implementation Manager,"Ability to articulate complex data problems or issues in a simple language that keeps audiences engaged.
Previous experience in developing and maturing data…","Cisco, DNS, HTTP, Networking, Network Engineer, Security, Video, VPN, Wireless",2 years,Police Digital Service,Remote,6 days ago
Project Manager (ref: PR2089),"They are at the initial stages of the project and this individual will play a key role in the selection of the system, work closely with the third party…",".NET , C#, MVC, RESTful web services, HTTP, AWS, Azure, OOP",1 year,Projentum,London,2 hours ago
Data Governance Analyst,"Professional experience in data governance, data management, privacy or risk roles - experience of operating in media or technology industries would be…","C++, Developer, Development, JavaScript, User Interface",2 years,Reach,Remote,2 days ago
Data Analyst,"NSD seeks two Data Analysts to provide data analysis and audit support activities for a portfolio of national networks and services, as well as additional…",Openstack,3 years,NHS Scotland,Remote in Glasgow,3 days ago
Project Manager,"Preparation and maintenance of project documentation.
The purpose of this role is to manage assigned business projects from initiation to completion, meeting or…","Unix, IAM, Scripting knowledge, OIM, Windows, Linux",3 years,Equiniti,Remote,2 days ago
Data Engineer,"Knowledge of modern Java alternatives (Golang or Rust).
Deep and broad understanding of Scala (or Java/Kotlin).
Distributed version control (Git preferred).","Java, OSS",5 year,Lloyds Banking Group,Hybrid remote in Chester,2 weeks ago
SOC ANALYST,"Confidence in effectively communicating technical incidents or security threats to non-technical stakeholders.
Security monitoring and first response.","Consulting, Project, Sales, Sales Engineer",2 year,Dynamic Search Solutions,Remote,2 hours ago
Project Manager,Evaluating the success of the project against its objectives and sharing lessons or best practice with other organisations or project managers.,mobile device,3 year,Police Digital Service,Remote,2 days ago
Data Scientist,"Head of Data Science and Machine Learning (Computer Vision).
£200000 - £280000 per annum.
Head of Data Science & Machine Learning (Computer Vision) Blockchain…","QA, Compliance testing",4 year,Xcede,Remote in England,2 weeks ago
Project Manager (Remote),"Desired Result: Deliver projects which meet or exceed client expectations.
Essential Function: Successfully manage complex concurrent projects from project win…","SkillAutomation Anywhere, UIPath, Blue Prism, or WinAutomation.",5 year,KLDiscovery,Remote in United Kingdom,2 weeks ago
Data Analyst,Work closely with the Marketing Database manager and the Business Intelligence data architects to manage the business data glossary and attribute standards.,"Desktop, Hardware, Network, Software, Systems, Windows",6 year,Jet2.com and Jet2holidays,Hybrid remote in Leeds,2 days ago
Project Manager - Submarines,"Familiar and delivered projects in accordance with NEC contract.
You will identify and acquire the means to achieve project requirements.","Analysis, Analyst, Application, Business Analyst, Business Requirements, Excel, IT, PowerPoint, Project",1 year,Rolls-Royce,Hybrid remote in Derby,2 weeks ago
"Journalism Researcher (China), Data and Analysis","You will be using your extensive knowledge to work on data journalism projects, fact-checking articles and simple online explanations of complex issues.","System Testing, Load/Performance Testing, FIX.FAST, C/C++, Java, Windows, Linux",2 years,BBC,Birmingham,2 hours ago
Graduate Data Analyst,"Degree level (or equivalent) in a relevant discipline, or Specific related experience.
Maintenance of pricing related data in relevant systems.","Agile, CASE, Consulting, Defect Management, Manager, Management, Project, Project Management",3 years,ENGIE,Leeds LS12,3 days ago
IUCS Service Improvement Manager - Data Analyst,The ability to interpret complex data to help services see where improvements can be made is a key element of the role.,"MATLAB, LabVIEW, Microsoft SQL",4 years,Dorset HealthCare University NHS Foundation Trust,Poole BH17,2 weeks ago
Project Manager,"Days leave per year (including 6 University Closure days and 8 days public holidays).
Excellent pension scheme (Employer contributions for USS are currently 21…","This position is a Product Manager in the Customer Experience team for Fulfillment by Amazon and Amazon Global Selling organization. Our vision is to transform global commerce by bringing selection from around the world to Customers anywhere in the world, with the same great customer experience Buyers expect from Amazon. In this role, you will set strategy and policy, build processes, and evangelize for technology solutions that allow third party Sellers from all over the world to bring hundreds of millions of new items to Amazon's 11 Marketplaces worldwide. You will determine what experience these Sellers must offer our customers, create the incentives and enforcement mechanisms to achieve this experience, and frequently audit the results. Responsibilities for this position will include creation of programs that drive improvement in our key customer experience metrics, management of global programs and stakeholders, and driving alignment for new programs at high levels of the organization. This position will also have management responsibility for product managers, data analysts, and an operations team.",5 years,University of Southampton,Hybrid remote in Southampton,7 days ago
Data Engineer,"Liaising with data and BI engineers, data modellers and non-technical stakeholders to ensure that your work always contributes to achieving Reach’s broader data…","Angular.JS, React, Node.js, JavaScript",6 years,Reach,Remote,3 hours ago
Project Manager - Global Logistics Services,"Manage project plans, report on status and update schedules from proposal submission through to task completion.
Project Management Qualified (APMP/Prince 2).","selenium testing automation, SQL, Business Intelligence tools",7 years,Leidos,Remote,2 days ago
Data Analyst (Graduate Trainee),Applicants should be passionate about data with excellent statistical and data analytical skills and have experience of working with large data sets.,"Splunk, .NET, C++",8 years,University of Aberdeen,Remote in Aberdeen,1 day ago
Project Manager (PM),"Effectively leading and motivating all project team members throughout project.
A degree or equivalent industry experience.","C and C++, Linux, UNIX, Javascript, SDLC",9 years,Ingeus UK,Remote,2 weeks ago
Data Analyst,"Management and development of a junior data analyst.
With 1.3m household customers, there is a real depth of data that can be leveraged to optimise business…",Bachelor's degree with 5 years of experience developing software applications in C++ preferably in a Linux environment is required. Experience with .NET or Java preferred.,5 years,Pelican Business Services,Nailsea,3 days ago
IT Project Manager (Agile & Waterfall),"The area, or Lab, you'll work within will be made up of multidisciplinary professionals including engineers, analysts, architects, business users, product…","Development, IT, Network, Project, Sales",3 years,Lloyds Banking Group,Hybrid remote in London,2 weeks ago
Data Analyst,"Provide data / analysis to other key stakeholders as required, for example to Operations Directors/Managers and the Heads of Contact Centres.","Highly Desired Experience and Skills include: Experience working in an iSeries (AS/400) environment. 2+ years of experience mapping in and supporting Gentran Server for iSeries environments. Experience with creation and maintenance of Trading Partners. Familiar with content management platforms and paradigms. SQL2014, HTML, CA2E, RPG, CL, and DB2 experience. Microsoft Office Suite, Office 365, Outlook. Ability to interface Client/Server applications as related to the iSeries. Highly organized. Great attention to detail. Strong oral and written communication skills. Ability to learn quickly and efficiently to meet the demands of multiple stakeholders eCommerce Responsibilities are a plus but will be something you will grow into in time:Work across teams to determine content needs. Edit, configure and publish content. Coordinate content publishing schedules. Create and run ad hoc SQL queries. Upload new users and new user information to the content management system. Become a subject matter expert and provide first level platform support",4 years,Marston Holding Limited,Hybrid remote in Oldham,2 days ago
Senior Business Analyst - Data Services,"Ideally, you also have experience working across implementing data platforms, operational analytics or advanced analytics, and building data products, either…","Scheduling, Primavera 6.0, Unifier, MS Project Stadard, EIT, Construction, Pharma or Biotech",5 years,Form3 Financial Cloud,Remote,1 week ago
